{
  "format": "cog-provider-evidence-v1",
  "provider_name": "Example transcription provider",
  "capabilities": [
    "transcription"
  ],
  "pricing": {
    "setup_cost_usd": "0",
    "per_task_cost_usd": "0.05",
    "hourly_cost_usd": null
  },
  "available": true,
  "claims": [
    "CAPABILITY",
    "PRICING",
    "AVAILABILITY"
  ],
  "max_age_days": 30,
  "expires_at": null,
  "confidence_score": 70,
  "authorization_requirements": [
    "Provider account required"
  ]
}
